Auction ID,Heading,Location,Bank Name,Reserve Price,Auction Date
58907,"Pent House in Kuppam Village, Kanchipuram","Kanchipuram, Tamil Nadu",Indian Overseas Bank,"₹2,97,47,500",29/06/2025
58915,"Flat in Sevilimedu, Kanchipuram","Kanchipuram, Tamil Nadu",Bank Of Baroda,"₹40,00,000",29/06/2025
58916,"Flat in Sevilimedu, Kanchipuram","Kanchipuram, Tamil Nadu",Bank Of Baroda,"₹40,00,000",29/06/2025
58921,"Flat in Thanneer Kulam Village, Thiruvallur","Tiruvallur, Tamil Nadu",UCO Bank,"₹30,57,000",29/06/2025
58926,"Flat in Borivali East, Mumbai","Mumbai City, Maharashtra",HDFC Bank,"₹24,75,000",29/06/2025
58927,"Flat in Mumbai, Mumbai","Mumbai City, Maharashtra",HDFC Bank,"₹15,50,000",29/06/2025
58929,"Flat in Borivali East, Mumbai","Mumbai City, Maharashtra",HDFC Bank,"₹16,75,000",29/06/2025
58930,"Flat in Chandivali, Mumbai","Mumbai City, Maharashtra",HDFC Bank,"₹76,00,000",29/06/2025
58931,"Land in Satara, Mumbai","Mumbai City, Maharashtra",Aavas Financiers,"₹7,11,219",29/06/2025
58932,"Land and Building in Nandurbar, Mumbai","Mumbai City, Maharashtra",Canara Bank,"₹18,86,000",29/06/2025
58934,"Land and Building in Nandurbar, Mumbai","Mumbai City, Maharashtra",Canara Bank,"₹18,86,000",29/06/2025
58935,"Commercial Property in Andheri East, Mumbai","Mumbai City, Maharashtra",Punjab National Bank,"₹1,71,00,000",29/06/2025
58936,"Industrial Plot in Andheri East, Mumbai","Mumbai City, Maharashtra",Punjab National Bank,"₹1,03,00,000",29/06/2025
58938,"Flat in Chandivali, Mumbai","Mumbai City, Maharashtra",HDFC Bank,"₹76,00,000",29/06/2025
58939,"Flat in Chandivali, Mumbai","Mumbai City, Maharashtra",HDFC Bank,"₹1,08,00,000",29/06/2025
58941,"Flat in Borivali East, Mumbai","Mumbai City, Maharashtra",HDFC Bank,"₹70,10,000",29/06/2025
58962,Land and Building in Cuddalore,"Cuddalore, Tamil Nadu",City Union Bank,"₹12,00,000",29/06/2025
58964,"Plot in Aravakurichi Village, Karur","Karur, Tamil Nadu",GIC Housing Finance,"₹10,03,200",29/06/2025
59021,Land in Howrah,"Howrah, West Bengal",Canara Bank,"₹32,00,000",29/06/2025
59030,Land and Building in Murshidabad,"Murshidabad, West Bengal",Punjab National Bank,"₹20,17,000",29/06/2025
59031,Land in Murshidabad,"Murshidabad, West Bengal",Punjab National Bank,"₹9,77,670",29/06/2025
59032,Land and Building in Murshidabad,"Murshidabad, West Bengal",Punjab National Bank,"₹16,76,700",29/06/2025
59051,Plot in Purba Medinipur,"Purba Medinipur, West Bengal",Canara Bank,"₹23,82,000",29/06/2025
59053,Residential Flat in Hooghly,"Hooghly, West Bengal",Canara Bank,"₹14,00,000",29/06/2025
59055,Residential Flat in Howrah,"Howrah, West Bengal",Canara Bank,"₹18,23,000",29/06/2025
59058,Flat in South 24 Paraganas,"South 24 Parganas, West Bengal",Canara Bank,"₹27,11,000",29/06/2025
59063,Plot in North 24 Parganas,"North 24 Parganas, West Bengal",Canara Bank,"₹35,65,000",29/06/2025
59065,Land and Building in Purba Medinipur,"Purba Medinipur, West Bengal",Canara Bank,"₹22,68,000",29/06/2025
59067,Land and Building in Paschim Medinipur,"Paschim Medinipur, West Bengal",Canara Bank,"₹15,97,000",29/06/2025
59069,Land and Building in Paschim Medinipur,"Paschim Medinipur, West Bengal",Canara Bank,"₹49,68,000",29/06/2025
59070,Plot in Paschim Medinipur,"Paschim Medinipur, West Bengal",Canara Bank,"₹10,46,000",29/06/2025
59071,"House in Varsamedi, Kachchh","Kutch, Gujarat",HomeFirst Finance,"₹6,30,320",29/06/2025
59075,"House in Jambudiya, Morbi","Morbi, Gujarat",HomeFirst Finance,"₹6,68,800",29/06/2025
59085,Land and Building in North 24 Parganas,"North 24 Parganas, West Bengal",Punjab National Bank,"₹25,00,000",29/06/2025
59087,Land and Building in North 24 Parganas,"North 24 Parganas, West Bengal",Punjab National Bank,"₹5,00,000",29/06/2025
59089,Land and Building in Haroa,"Haroa, Kolkata, West Bengal",Punjab National Bank,"₹50,00,000",29/06/2025
59090,Land and Building in Paikpara,"Paikpara, Kolkata, West Bengal",Punjab National Bank,"₹10,00,000",29/06/2025
59095,"Plot in Varsamedi, Kutch","Kutch, Gujarat",Canara Bank,"₹9,95,000",29/06/2025
59104,"Land and Building in Varsamedi, Kachchh","Kutch, Gujarat",Canara Bank,"₹11,35,000",29/06/2025
59111,"House in Anjar, Kachchh","Kutch, Gujarat",Canara Bank,"₹9,50,000",29/06/2025
59124,"Land and Building in Varsamedi, Kachchh","Kutch, Gujarat",Canara Bank,"₹5,80,000",29/06/2025
59125,"House in Varsamedi, Kutch","Kutch, Gujarat",Canara Bank,"₹4,50,000",29/06/2025
59146,Land in North 24 Parganas,"North 24 Parganas, West Bengal",Punjab National Bank,"₹25,00,000",29/06/2025
59150,Plot in Deganga,"Deganga, Kolkata, West Bengal",Punjab National Bank,"₹17,00,000",29/06/2025
59152,Land and Building in North 24 Parganas,"North 24 Parganas, West Bengal",Punjab National Bank,"₹20,00,000",29/06/2025
59154,Land and Building in North 24 Parganas,"North 24 Parganas, West Bengal",Punjab National Bank,"₹10,00,000",29/06/2025
59156,Land in North 24 Parganas,"North 24 Parganas, West Bengal",Punjab National Bank,"₹17,00,000",29/06/2025
59157,Land and Building in North 24 Parganas,"North 24 Parganas, West Bengal",Punjab National Bank,"₹17,00,000",29/06/2025
59159,Land and Building in Barrackpore,"Barrackpore, Kolkata, West Bengal",Punjab National Bank,"₹20,00,000",29/06/2025
59161,Land and Building in North 24 Parganas,"North 24 Parganas, West Bengal",Punjab National Bank,"₹7,50,000",29/06/2025
59163,Land and Building in North 24 Parganas,"North 24 Parganas, West Bengal",Punjab National Bank,"₹11,00,000",29/06/2025
59165,Land and Building in Rajapur,"Rajapur, Kolkata, West Bengal",Punjab National Bank,"₹40,00,000",29/06/2025
59166,Land and Building in Baduria,"Baduria, Kolkata, West Bengal",Punjab National Bank,"₹20,00,000",29/06/2025
59184,Residential Flat in Birbhum,"Birbhum, Kolkata, West Bengal",Punjab National Bank,"₹18,38,000",29/06/2025
59187,Flat in Hooghly,"Hooghly, West Bengal",Bank Of Baroda,"₹15,31,000",29/06/2025
59196,House in Sangrur,"Sangrur, Punjab",Sammaan Capital Ltd,"₹11,00,000",29/06/2025
59201,Plot in Kohara Road,"Kohara Road, Ludhiana, Punjab",HDFC Bank,"₹26,00,000",29/06/2025
59345,Land and Building in Amritsar,"Amritsar, Punjab",HDFC Bank,"₹14,70,000",29/06/2025
59354,Plot in Challakere,"Challakere, Bangalore Urba, Karnataka",ICICI Bank,"₹8,50,00,000",29/06/2025
59370,"House in Ramnad, Ramanathapuram,","Ramanathapuram, Tamil Nadu",GIC Housing Finance,"₹4,96,736",29/06/2025
59372,Land in Hooghly,"Hooghly, West Bengal",Punjab National Bank,"₹14,32,000",29/06/2025
59373,Residential Flat in Hooghly,"Hooghly, West Bengal",Punjab National Bank,"₹25,86,000",29/06/2025
59374,Residential Flat in Hooghly,"Hooghly, West Bengal",Punjab National Bank,"₹20,42,000",29/06/2025
59375,Residential Flat in Hooghly,"Hooghly, West Bengal",Punjab National Bank,"₹22,93,000",29/06/2025
59376,Land and Building in Hooghly,"Hooghly, West Bengal",Punjab National Bank,"₹21,69,000",29/06/2025
60760,"Plot in Jalna, Pune","Pune, Maharashtra",Canara Bank,"₹2,32,000",29/06/2025
60762,"Commercial Property in Melodina Road, Pune","Pune, Maharashtra",HDFC Bank,"₹57,75,000",29/06/2025
60766,"Commercial Property in Melodina Road, Pune","Pune, Maharashtra",HDFC Bank,"₹58,20,000",29/06/2025
60769,"Commercial Property in Sadashiv Peth, Pune","Pune, Maharashtra",HDFC Bank,"₹2,05,00,000",29/06/2025
60771,"Commercial Property in Sinhagad Road,, Pune","Pune, Maharashtra",HDFC Bank,"₹1,59,00,000",29/06/2025
60772,"Commercial Property in Sinhagad Road,, Pune","Pune, Maharashtra",HDFC Bank,"₹1,59,00,000",29/06/2025
60774,"Commercial Property in Pune, Pune","Pune, Maharashtra",HDFC Bank,"₹65,00,000",29/06/2025
60776,"Flat in Kondhwa Budruk, Pune","Pune, Maharashtra",HDFC Bank,"₹85,00,000",29/06/2025
60778,"Commercial Property in Melodina Road, Pune","Pune, Maharashtra",HDFC Bank,"₹57,75,000",29/06/2025
60780,"Commercial Property in Melodina Road, Pune","Pune, Maharashtra",HDFC Bank,"₹58,20,000",29/06/2025
60781,"Commercial Property in Sadashiv Peth, Pune","Pune, Maharashtra",HDFC Bank,"₹2,05,00,000",29/06/2025
60781,"Commercial Property in Sadashiv Peth, Pune","Pune, Maharashtra",HDFC Bank,"₹2,05,00,000",29/06/2025
60784,"Flat in Wadakigaon, Pune","Pune, Maharashtra",HomeFirst Finance,"₹16,12,000",29/06/2025
60787,"Flat in Alandi Devachi, Pune","Pune, Maharashtra",Phoenix ARC,"₹8,14,858",29/06/2025
60789,"Flat in Kadam Wak wasti, Pune","Pune, Maharashtra",Phoenix ARC,"₹12,22,412",29/06/2025
60792,"Flat in Wagholi, Pune","Pune, Maharashtra",Phoenix ARC,"₹16,74,450",29/06/2025
60793,"Flat in Kirkitwadi, Pune","Pune, Maharashtra",Phoenix ARC,"₹9,70,506",29/06/2025
60796,"Flat in Daund, Pune","Pune, Maharashtra",Phoenix ARC,"₹9,60,000",29/06/2025
60798,"Flat in Kedgaon, Pune","Pune, Maharashtra",Phoenix ARC,"₹9,60,000",29/06/2025
60802,"Flat in Kedgaon, Pune","Pune, Maharashtra",Phoenix ARC,"₹9,60,000",29/06/2025
60805,"Flat in Durga Mata Temple, Pune","Pune, Maharashtra",Phoenix ARC,"₹19,66,564",29/06/2025
60806,"Flat in Kirkitwadi, Pune","Pune, Maharashtra",Phoenix ARC,"₹9,70,506",29/06/2025
60809,"Flat in Wagholi, Pune","Pune, Maharashtra",Phoenix ARC,"₹16,74,450",29/06/2025
60811,"Flat in Kadam Wak wasti, Pune","Pune, Maharashtra",Phoenix ARC,"₹12,22,412",29/06/2025
60813,"Flat in Wagholi, Pune","Pune, Maharashtra",Aditya Birla Housing Finance,"₹34,44,300",29/06/2025
60815,"Flat in Wadakigaon, Pune","Pune, Maharashtra",HomeFirst Finance,"₹16,12,000",29/06/2025
60817,"Flat in taluka haveli, Pune","Pune, Maharashtra",Phoenix ARC,"₹6,80,818",29/06/2025
60818,"Flat in Kedgaon, Pune","Pune, Maharashtra",Phoenix ARC,"₹9,60,000",29/06/2025
60820,"Flat in Manjri, Pune","Pune, Maharashtra",Phoenix ARC,"₹12,78,123",29/06/2025
60822,"Flat in Katraj, Pune","Pune, Maharashtra",Phoenix ARC,"₹19,00,809",29/06/2025
60824,"Flat in Kirkatwadi, Pune","Pune, Maharashtra",Phoenix ARC,"₹14,18,413",29/06/2025
60825,"Flat in Alandi Devachi, Pune","Pune, Maharashtra",Phoenix ARC,"₹8,14,858",29/06/2025
60827,"Flat in Kadam Wak wasti, Pune","Pune, Maharashtra",Phoenix ARC,"₹12,22,412",29/06/2025
60829,"Flat in Wagholi, Pune","Pune, Maharashtra",Phoenix ARC,"₹16,74,450",29/06/2025
60831,"Flat in Kirkitwadi, Pune","Pune, Maharashtra",Phoenix ARC,"₹9,70,506",29/06/2025
60832,"Flat in Durga Mata Temple, Pune","Pune, Maharashtra",Phoenix ARC,"₹19,66,564",29/06/2025
60833,"Flat in Durga Mata Temple, Pune","Pune, Maharashtra",Phoenix ARC,"₹19,66,564",29/06/2025
60834,"Flat in Kedgaon, Pune","Pune, Maharashtra",Phoenix ARC,"₹9,60,000",29/06/2025
60969,Land and Building for Sale,"Thrissur, Kerala",Canara Bank,"₹8,00,000",29/06/2025
60972,Land and Building for Sale,"Puthenvelikkara, Ernakulam, Kerala",Canara Bank,"₹3,28,43,000",29/06/2025
60974,Land and Building for Sale,"Thirumaradi Village, Ernakulam, Kerala",Canara Bank,"₹26,03,000",29/06/2025
60975,Land and Building for Sale,"Kumbalanghi, Ernakulam, Kerala",Canara Bank,"₹29,15,000",29/06/2025
60976,Land and Building for Sale,"Vembilly, Ernakulam, Kerala",Canara Bank,"₹33,17,000",29/06/2025
60978,Land and Building for Sale,"Kottuvally, Ernakulam, Kerala",Canara Bank,"₹28,30,000",29/06/2025
60984,Land for Sale,"Aroor Village, Alappuzha, Kerala",Canara Bank,"₹1,00,98,000",29/06/2025
60985,Land and Building for Sale,"Vazhakkala, Ernakulam, Kerala",Canara Bank,"₹24,21,000",29/06/2025
60986,Land and Building for Sale,"Mulavukad, Ernakulam, Kerala",Canara Bank,"₹12,17,000",29/06/2025
60989,Land and Building for Sale,"Nadama, Ernakulam, Kerala",Canara Bank,"₹40,49,000",29/06/2025
60991,Land for Sale,"Arakkal, Kollam, Kerala",Canara Bank,"₹57,23,000",29/06/2025
60993,Land and Building for Sale,"Rameshwaram, Ernakulam, Kerala",Canara Bank,"₹14,09,000",29/06/2025
60995,Flat for Sale,"Elamkunnapuzha Village, Ernakulam, Kerala",Canara Bank,"₹59,00,000",29/06/2025
60996,Land and Building for Sale,"Thuravoor, Ernakulam, Kerala",Canara Bank,"₹1,30,00,000",29/06/2025
61000,Land and Building for Sale,"Edappally South, Ernakulam, Kerala",Canara Bank,"₹47,52,000",29/06/2025
61002,Land and Building for Sale,"Kumbalanghi, Ernakulam, Kerala",Canara Bank,"₹9,66,000",29/06/2025
61004,Land and Building for Sale,"Arakkapady, Ernakulam, Kerala",Canara Bank,"₹18,36,000",29/06/2025
61006,Land and Building for Sale,"Nadama, Ernakulam, Kerala",Canara Bank,"₹19,38,000",29/06/2025
61007,Land and Building for Sale,"Nadama, Ernakulam, Kerala",Canara Bank,"₹24,77,000",29/06/2025
61008,Land and Building for Sale,"Rameshwaram, Ernakulam, Kerala",Canara Bank,"₹22,59,000",29/06/2025
61010,Land and Building for Sale,"Elanji, Ernakulam, Kerala",Canara Bank,"₹40,18,000",29/06/2025
61016,Land and Building for Sale,"Eramalloor, Ernakulam, Kerala",Canara Bank,"₹39,55,000",29/06/2025
61048,Land and Building for Sale,"Edavanakkad, Ernakulam, Kerala",Canara Bank,"₹11,76,000",29/06/2025
61049,Land and Building for Sale,"Eloor Village, Ernakulam, Kerala",Canara Bank,"₹19,78,000",29/06/2025
61050,Land and Building for Sale,"Kanjiramkulam, Thiruvananthapuram, Kerala",Canara Bank,"₹31,50,000",29/06/2025
61089,Residential Plot in Udupi,"Udupi, Karnataka",Bank of India,"₹81,00,000",29/06/2025
61101,Commercial Property in Bantwal,"Bantwal, Mangalore, Karnataka",State Bank of India,"₹2,18,50,000",29/06/2025
61123,House in Dakshina Kannada,"Dakshina Kannada, Karnataka",Canara Bank,"₹11,00,000",29/06/2025
61124,House in Moodabidri,"Moodabidri, Mangalore, Karnataka",Canara Bank,"₹40,00,000",29/06/2025
61126,Commercial Property in Bajpe,"Bajpe, Mangalore, Karnataka",Canara Bank,"₹9,00,000",29/06/2025
61127,Land in Pranthya,"Pranthya, Mangalore, Karnataka",Canara Bank,"₹8,25,000",29/06/2025
61321,"Land in Malegaon, Nashik","Nashik, Maharashtra",Canara Bank,"₹42,30,000",29/06/2025
61322,"House in Eklahare, Nashik","Nashik, Maharashtra",Canara Bank,"₹27,00,000",29/06/2025
61323,"Flat in Wadala, Nashik","Nashik, Maharashtra",Canara Bank,"₹24,00,000",29/06/2025
61324,"Flat in Shiwar, Nashik","Nashik, Maharashtra",Canara Bank,"₹30,00,000",29/06/2025
61325,"Residential Flat in Makhmalabad, Nashik","Nashik, Maharashtra",Canara Bank,"₹23,17,000",29/06/2025
61326,"Residential Flat in Makhmalabad, Nashik","Nashik, Maharashtra",Canara Bank,"₹30,05,000",29/06/2025
61327,"Residential Flat in Girnare, Nashik","Nashik, Maharashtra",Canara Bank,"₹27,25,000",29/06/2025
61328,"Flat in Dwarka, Nashik","Nashik, Maharashtra",Canara Bank,"₹18,50,000",29/06/2025
61329,"Residential Flat in Girnare, Nashik","Nashik, Maharashtra",Canara Bank,"₹31,75,000",29/06/2025
61330,"Flat in Adgaon, Nashik","Nashik, Maharashtra",HomeFirst Finance,"₹13,35,000",29/06/2025
61356,"Flat in Kodambakkam, Chennai","Chennai, Tamil Nadu",Canara Bank,"₹84,25,000",29/06/2025
59380,Residential Flat in Hooghly,"Hooghly, West Bengal",Punjab National Bank,"₹8,09,000",29/06/2025
59381,Residential Flat in Hooghly,"Hooghly, West Bengal",Punjab National Bank,"₹19,13,000",29/06/2025
59383,Commercial Property in Hooghly,"Hooghly, West Bengal",Punjab National Bank,"₹23,53,000",29/06/2025
59385,Land and Building in Hooghly,"Hooghly, West Bengal",Punjab National Bank,"₹13,14,000",29/06/2025
59418,"Land and Building in Parambur, Pudukottai","Pudukkottai, Tamil Nadu",Indian Overseas Bank,"₹13,82,300",29/06/2025
59420,"Land and Building in Melmugam, Namakkal","Namakkal, Tamil Nadu",Indian Bank,"₹64,80,000",29/06/2025
59422,"Flat in Kathirvedu, Chennai","Chennai, Tamil Nadu",HomeFirst Finance,"₹27,72,000",29/06/2025
59431,"Plot in Poonampalayam, Tiruchirapalli","Tiruchirappalli, Tamil Nadu",Canara Bank,"₹45,09,000",29/06/2025
59529,Land and Building in Madnipur,"Madnipur, Ludhiana, Punjab",IDBI Bank,"₹14,41,000",29/06/2025
59532,"House in Villapuram, Madurai","Madurai, Tamil Nadu",GIC Housing Finance,"₹5,65,502",29/06/2025
59533,"House in Bala Krishnapuram, Dindugul","Dindigul, Tamil Nadu",GIC Housing Finance,"₹18,63,710",29/06/2025
59575,"House in Karanaithangal, Kancheepuram","Kanchipuram, Tamil Nadu",HomeFirst Finance,"₹9,99,375",29/06/2025
59641,"Industrial Property in Mettupatty, Salem","Salem, Tamil Nadu",Omkara Assets Reconstruction,"₹5,50,00,000",29/06/2025
59642,"Industrial Property in Naickenpatti, Salem","Salem, Tamil Nadu",Omkara Assets Reconstruction,"₹1,50,00,000",29/06/2025
59643,"Industrial Property in Pallapatti, Salem","Salem, Tamil Nadu",Omkara Assets Reconstruction,"₹3,50,00,000",29/06/2025
59647,House in Jamabandi,"Jamabandi, Ludhiana, Punjab",Indian Overseas Bank,"₹18,99,000",29/06/2025
59654,"Plot in Nanthiyambakkam, Thiruvallur","Tiruvallur, Tamil Nadu",HomeFirst Finance,"₹29,28,650",29/06/2025
59655,"Plot in Oragadam Village, Thiruvallur","Tiruvallur, Tamil Nadu",HomeFirst Finance,"₹14,50,000",29/06/2025
59656,"Plot in Kovilkuppam Village, Thiruvallur","Tiruvallur, Tamil Nadu",HomeFirst Finance,"₹14,96,200",29/06/2025
59675,"Plot in Poonampalayam, Tiruchirapalli","Tiruchirappalli, Tamil Nadu",Canara Bank,"₹45,09,000",29/06/2025
59678,"Land in Theerampalayam Village, Tiruchirappalli","Tiruchirappalli, Tamil Nadu",Canara Bank,"₹24,35,000",29/06/2025
59698,"Land in Sholamadevi Village, Tiruppur","Tirupur, Tamil Nadu",Canara Bank,"₹7,50,000",29/06/2025
59701,"Land and Building in Kasilingampalayam, Tiruppur","Tirupur, Tamil Nadu",Canara Bank,"₹2,75,27,000",29/06/2025
59714,"Industrial Property in Elanthanchery Village, Tiruvallur","Tiruvallur, Tamil Nadu",Omkara Assets Reconstruction,"₹5,50,00,000",29/06/2025
59729,"Land and Building in Valavandankottai, Trichy","Tiruchirappalli, Tamil Nadu",Canara Bank,"₹22,82,000",29/06/2025
59734,"Plot in Theerampalayam, Tiruchirapalli","Tiruchirappalli, Tamil Nadu",Canara Bank,"₹24,35,000",29/06/2025
59739,"Plot in Ameenabath Village, Ariyalur","Ariyalur, Tamil Nadu",Canara Bank,"₹3,95,000",29/06/2025
59762,"House site in Vandanviduthi, Pudukkottai","Pudukkottai, Tamil Nadu",Canara Bank,"₹22,06,000",29/06/2025
59800,Land and Building in Koppa,"Koppa, Bangalore Urba, Karnataka",Canara Bank,"₹22,60,000",29/06/2025
59803,Land and Building in chikmagalur,"Chikkamagaluru, Karnataka",Canara Bank,"₹11,00,000",29/06/2025
59804,"House in Varsamedi, Kutch","Kutch, Gujarat",Canara Bank,"₹8,10,000",29/06/2025
59806,"House in Amreli, Morbi","Morbi, Gujarat",Canara Bank,"₹7,80,000",29/06/2025
59810,Residential Plot in Chikkamagaluru,"Chikkamagaluru, Karnataka",Canara Bank,"₹14,30,000",29/06/2025
59812,"House in Amreli, Morbi","Morbi, Gujarat",Canara Bank,"₹6,70,000",29/06/2025
59814,"Plot in Bhuj, Kachchh","Kutch, Gujarat",Canara Bank,"₹22,88,000",29/06/2025
59839,"Flat in Vejalpur, Ahmedabad","Ahmedabad, Gujarat",Aavas Financiers,"₹84,70,800",29/06/2025
59842,Plot in Surendranagar,"Surendranagar, Gujarat",Aavas Financiers,"₹15,78,365",29/06/2025
59845,Residential Plot in Sarjapura,"Sarjapura, Bangalore Urba, Karnataka",Canara Bank,"₹1,01,61,300",29/06/2025
59858,"House in Bhuj, Kutch","Kutch, Gujarat",Bajaj housing finance limited,"₹8,00,000",29/06/2025
59870,Plot in Haveri,"Haveri, Karnataka",Canara Bank,"₹81,00,000",29/06/2025
59875,Plot in Kasaba Hobli,"Kasaba Hobli, Bangalore Urba, Karnataka",Canara Bank,"₹7,90,00,000",29/06/2025
59876,Site in Kasaba Hobli,"Kasaba Hobli, Bangalore Urba, Karnataka",Canara Bank,"₹3,01,00,000",29/06/2025
59884,"House in Gondal, Rajkot","Rajkot, Gujarat",HomeFirst Finance,"₹12,41,648",29/06/2025
59886,House in Kalaburagi,"Kalaburagi, Bangalore Urba, Karnataka",Canara Bank,"₹23,70,000",29/06/2025
59888,House in Bidar,"Bidar, Bangalore Urba, Karnataka",Canara Bank,"₹85,15,000",29/06/2025
59891,House in Kalaburagi,"Kalaburagi, Bangalore Urba, Karnataka",Canara Bank,"₹90,25,000",29/06/2025
59892,House in Kalaburagi,"Kalaburagi, Bangalore Urba, Karnataka",Canara Bank,"₹32,00,000",29/06/2025
59893,Plot in Bidar,"Bidar, Karnataka",Canara Bank,"₹17,80,000",29/06/2025
59894,Plot in Bidar,"Bidar, Karnataka",Canara Bank,"₹39,20,000",29/06/2025
59965,Land in Sakleshpura,"Sakleshpura, Bangalore Urba, Karnataka",Canara Bank,"₹49,10,000",29/06/2025
59969,Land and Building in Kengeri Hobli,"Kengeri Hobli, Bangalore Urba, Karnataka",Axis Bank,"₹1,16,76,000",29/06/2025
59970,Plot in Sakleshpura,"Sakleshpura, Bangalore Urba, Karnataka",Canara Bank,"₹57,38,000",29/06/2025
59971,Plot in Hassan,"Hassa, Karnataka",Canara Bank,"₹42,20,000",29/06/2025
59991,Commercial Property in Chamarajanagar,"Chamarajanagar, Bangalore Urba, Karnataka",Hinduja Housing Finance,"₹70,00,000",29/06/2025
59992,Plot in Kasaba Hobli,"Kasaba Hobli, Bangalore Urba, Karnataka",Hinduja Housing Finance,"₹22,80,000",29/06/2025
59993,House in Nagamangala,"Nagamangala, Bangalore Urba, Karnataka",Hinduja Housing Finance,"₹33,00,000",29/06/2025
60001,Land in udupi,"Udupi, Karnataka",Canara Bank,"₹14,88,000",29/06/2025
60020,"Land in Pachaiyankuppam, Cuddalore","Cuddalore, Tamil Nadu",Canara Bank,"₹7,50,000",29/06/2025
60103,Commercial Property in Kanakapura,"Kanakapura, Bangalore Urba, Karnataka",Indian Overseas Bank,"₹56,94,100",29/06/2025
60220,"Land and Building in Rendankulam, Sivaganga","Sivaganga, Tamil Nadu",Canara Bank,"₹21,38,000",29/06/2025
60255,Plot in Mandya,"Mandya, Karnataka",Hinduja Housing Finance,"₹11,30,000",29/06/2025
60256,House in Chamarajanagar,"Chamarajnagar, Karnataka",Hinduja Housing Finance,"₹50,00,000",29/06/2025
60257,House in Chamarajanagar,"Chamarajnagar, Karnataka",Hinduja Housing Finance,"₹28,50,000",29/06/2025
61511,"Flat in Bhingar, Ahmednagar","Ahmednagar, Maharashtra",Bank Of Baroda,"₹9,36,000",29/06/2025
61512,"Flat in Shirdi, Ahmednagar","Ahmednagar, Maharashtra",Canara Bank,"₹15,82,500",29/06/2025
61513,"Land and Building in Shirdi, Ahmednagar","Ahmednagar, Maharashtra",Canara Bank,"₹48,60,000",29/06/2025
61527,Residential Flat in Balichak,"Balichak, Kolkata, West Bengal",Karnataka Bank,"₹23,42,000",29/06/2025
61528,Residential Plot in South 24 Paraganas,"South 24 Parganas, West Bengal",Karnataka Bank,"₹20,00,000",29/06/2025
61540,Commercial Property in Barasat,"Barasat, Kolkata, West Bengal",Bank Of Baroda,"₹31,85,000",29/06/2025
61622,"Plot in Jadayampalayam, Coimbatore","Coimbatore, Tamil Nadu",Canara Bank,"₹2,23,37,000",29/06/2025
61714,"Plot in Neelangarai, Kancheepuram","Kanchipuram, Tamil Nadu",State Bank of India,"₹1,37,00,000",29/06/2025
61716,"Land and Building in Minjur Village, Kanchipuram","Kanchipuram, Tamil Nadu",Asset Reconstruction Company India Ltd,"₹40,25,000",29/06/2025
61721,"Land in Aralvoimozhi, Kanyakumari","Kanyakumari, Tamil Nadu",Karur Vysya Bank,"₹1,14,00,000",29/06/2025
61722,"Land and Building in Seelanaickenpatty, Salem","Salem, Tamil Nadu",Canara Bank,"₹1,09,52,000",29/06/2025
61724,"Land and Building in Chh. Sambhajinagar, Aurangabad","Aurangabad, Maharashtra",Canara Bank,"₹17,20,000",29/06/2025
61725,"Industrial Land and Building in Karodi, Aurangabad","Aurangabad, Maharashtra",Canara Bank,"₹54,00,000",29/06/2025
61726,"Flat in Aurangabad, Aurangabad","Aurangabad, Maharashtra",Canara Bank,"₹40,82,000",29/06/2025
61728,"Flat in Garkheda, Aurangabad","Aurangabad, Maharashtra",Canara Bank,"₹34,00,000",29/06/2025
61729,"Residential Plot in Mohalla-Chaudhary Nagar, Aurangabad","Aurangabad, Maharashtra",Canara Bank,"₹9,50,000",29/06/2025
61736,"Site in Elamanam Village, Tiruchirapalli","Tiruchirappalli, Tamil Nadu",Cholamandalam Investment and Finance Company,"₹56,55,600",29/06/2025
60412,"Land in Valavachaghoshtam village, Kanyakumari","Kanyakumari, Tamil Nadu",Canara Bank,"₹15,50,000",29/06/2025
60413,"Land in Veeyanoor, Kanyakumari","Kanyakumari, Tamil Nadu",Canara Bank,"₹8,88,000",29/06/2025
60414,"Plot in Valavachaghoshtam, Kanyakumari","Kanyakumari, Tamil Nadu",Canara Bank,"₹8,80,000",29/06/2025
60614,"Bungalow in Shankheshwar, Patan","Pata, Gujarat",City Union Bank,"₹20,00,000",29/06/2025
60617,"Commercial Property in Shankheshwar, Patan","Pata, Gujarat",City Union Bank,"₹3,00,000",29/06/2025
60621,"Commercial Property in Shaneswar, Patan","Pata, Gujarat",City Union Bank,"₹3,00,000",29/06/2025
60624,"Commercial Property in Shankheshwar, Patan","Pata, Gujarat",City Union Bank,"₹3,00,000",29/06/2025
60626,"Commercial Property in Shankheshwar, Patan","Pata, Gujarat",City Union Bank,"₹39,00,000",29/06/2025
60629,"Bungalow in Shankheshwar, Patan","Pata, Gujarat",City Union Bank,"₹20,00,000",29/06/2025
60636,"Commercial Property in Shankheshwar, Patan","Pata, Gujarat",City Union Bank,"₹3,00,000",29/06/2025
60639,"Commercial Property in Shankheshwar, Patan","Pata, Gujarat",City Union Bank,"₹3,00,000",29/06/2025
60641,"Commercial Property in Shankheshwar, Patan","Pata, Gujarat",City Union Bank,"₹3,00,000",29/06/2025
60643,"Commercial Property in Shankheshwar, Patan","Pata, Gujarat",City Union Bank,"₹3,00,000",29/06/2025
60652,"Commercial Property in Shankheshwar, Patan","Pata, Gujarat",City Union Bank,"₹8,00,000",29/06/2025
60725,Land and Building in Hooghly,"Hooghly, West Bengal",Punjab National Bank,"₹1,98,91,000",29/06/2025
60726,Land and Building in Hooghly,"Hooghly, West Bengal",Punjab National Bank,"₹24,50,000",29/06/2025
60727,Commercial Property in Hooghly,"Hooghly, West Bengal",Punjab National Bank,"₹28,87,000",29/06/2025
60728,Land and Building in Hooghly,"Hooghly, West Bengal",Punjab National Bank,"₹19,44,000",29/06/2025
60729,Land and Building in Hooghly,"Hooghly, West Bengal",Punjab National Bank,"₹19,44,000",29/06/2025
60732,Land and Building in Hooghly,"Hooghly, West Bengal",Punjab National Bank,"₹50,18,000",29/06/2025
