Auction ID,Heading,Location,Bank Name,Reserve Price,Auction Date
58451,Land and Building in Kolkata,"Kolkata, West Bengal",Indian Bank,"₹15,65,000",08/07/2025
58509,Land in Sirsa,"Sirsa, Haryana",Au small finance bank,"₹7,55,000",08/07/2025
21224,Land and building in Chennai,"Chennai, Tamil Nadu",Bank of India,"₹2,32,00,000",08/07/2025
25679,"Land in Kallalangudi, Pudukottai","Pudukkottai, Tamil Nadu",City Union Bank,"₹65,00,000",08/07/2025
26505,"House in Sadayankuppam, Chennai","Chennai, Tamil Nadu",HDB Financial Service,"₹1,56,82,410",08/07/2025
56959,"Flat in Vapi, Valsad","Valsad, Gujarat",Au small finance bank,"₹15,05,000",08/07/2025
57192,"Land in Virpur, Mahisagar","Mahisagar, Gujarat",Au small finance bank,"₹9,50,000",08/07/2025
33003,"Plot in Tirupathur Village, Vellore","Vellore, Tamil Nadu",Piramal Capital and Housing Finance,"₹18,60,000",08/07/2025
33322,"Land and Building in Sankari, Salem","Salem, Tamil Nadu",Indian Bank,"₹1,60,00,000",08/07/2025
33327,"Flat in Kumarapalayam, Coimbatore","Coimbatore, Tamil Nadu",Bank of India,"₹3,49,62,300",08/07/2025
33453,"Flat in Thindal, Erode","Erode, Tamil Nadu",Karur Vysya Bank,"₹52,00,000",08/07/2025
33486,"Industrial Property in Nilakottai Village, Dindigul","Dindigul, Tamil Nadu",Bank of India,"₹3,70,00,000",08/07/2025
33853,"Land in Aayappakkam, Chengalpet","Chengalpet, Tamil Nadu",Bank of India,"₹43,00,000",08/07/2025
33854,"Land and Building in Naravarikuppam, Thiruvallur","Tiruvallur, Tamil Nadu",Bank of India,"₹83,00,000",08/07/2025
33855,"Land and Building in Aayappakkam Village, Chengalpet","Chengalpet, Tamil Nadu",Bank of India,"₹52,00,000",08/07/2025
33856,"Land in Aayappakkam Village, Chengalpet","Chengalpet, Tamil Nadu",Bank of India,"₹14,00,000",08/07/2025
33860,"Flat in Vizhinjiyampakkam, Thiruvallur","Tiruvallur, Tamil Nadu",Bank of India,"₹32,00,000",08/07/2025
33861,"Flat in Vizhinjiyampakkam, Thiruvallur","Tiruvallur, Tamil Nadu",Bank of India,"₹15,00,000",08/07/2025
33862,"Flat in Vizhinjiyampakkam, Thiruvallur","Tiruvallur, Tamil Nadu",Bank of India,"₹27,00,000",08/07/2025
33863,"Flat in Vizhinjiyampakkam, Thiruvallur","Tiruvallur, Tamil Nadu",Bank of India,"₹27,00,000",08/07/2025
35428,"Land in Vadapalani, Chennai","Chennai, Tamil Nadu",Piramal Capital and Housing Finance,"₹1,77,40,000",08/07/2025
35861,"Land and Building in Gudiyatham, Vellore","Vellore, Tamil Nadu",Bank of India,"₹26,00,000",08/07/2025
36016,"Land and Building in Thazhayattam, Vellore","Vellore, Tamil Nadu",Bank of India,"₹51,00,000",08/07/2025
36019,"Land and Building in Gudiyatham, Vellore","Vellore, Tamil Nadu",Bank of India,"₹18,00,000",08/07/2025
36022,"Land in Sethukkarai Village, Gudiyatham - Vellore","Vellore, Tamil Nadu",Bank of India,"₹21,00,000",08/07/2025
37619,"Flat in Sholinganallur, Kanchipuram","Kanchipuram, Tamil Nadu",State Bank of India,"₹43,00,000",08/07/2025
38133,"Land in Devicode Village, Kanyakumari","Kanyakumari, Tamil Nadu",Griham Housing Finance,"₹12,80,000",08/07/2025
42582,"Land and Building in Palangarai, Tiruppur","Tirupur, Tamil Nadu",Truhome Finance Limited,"₹8,50,000",08/07/2025
46355,"Land and Building in George Town, Chennai","Chennai, Tamil Nadu",City Union Bank,"₹54,00,000",08/07/2025
48702,"Land and Building in Sethurayanpudur, Tirunelveli","Tirunelveli, Tamil Nadu",Indian Bank,"₹70,00,000",08/07/2025
50499,"Flat in Ninnakarai, Kanchipuram","Kanchipuram, Tamil Nadu",Piramal Capital and Housing Finance,"₹25,90,000",08/07/2025
50510,"Flat in Poonamallee, Tiruvallur","Tiruvallur, Tamil Nadu",Piramal Capital and Housing Finance,"₹28,00,000",08/07/2025
50533,"Flat in kayarambedu, Chennai","Chennai, Tamil Nadu",Piramal Capital and Housing Finance,"₹17,40,000",08/07/2025
50536,"Flat in Kilpauk, Chennai","Chennai, Tamil Nadu",Piramal Capital and Housing Finance,"₹1,30,10,000",08/07/2025
52169,"Residential Property in Labbipeta, Vijayawada","Labbipeta, Vijayawada, Andhra Pradesh",Gandhi cooperative urban bank,"₹10,00,000",08/07/2025
53246,"Land and Building in Gudalur, Nigiris","Nilgiris, Tamil Nadu",Canara Bank,"₹25,10,000",08/07/2025
53360,"House in Dudhrej, Surendranager","Surendranagar, Gujarat",Cholamandalam Investment and Finance Company,"₹17,64,503",08/07/2025
53799,Land and Building in Hooghly,"Mogra, Hooghly, West Bengal",Canara Bank,"₹7,05,000",08/07/2025
28010,"Flat in Pallikaranai, Chennai","Chennai, Tamil Nadu",Bank of India,"₹32,00,000",08/07/2025
29451,Plot in Tuticorin,"Thoothukudi, Tamil Nadu",City Union Bank,"₹2,58,00,000",08/07/2025
30520,"Flat in Mandavelipakkam, Chennai","Chennai, Tamil Nadu",Bank of India,"₹2,00,00,000",08/07/2025
30846,"Land and Building in Peedampalli, Coimbatore","Coimbatore, Tamil Nadu",Bank of India,"₹60,25,000",08/07/2025
31151,"Land and Building in Keezhiruppu, Cuddalore","Cuddalore, Tamil Nadu",City Union Bank,"₹5,00,000",08/07/2025
31744,"Land in Vedapatti, Coimbatore","Coimbatore, Tamil Nadu",Bank of India,"₹1,36,32,300",08/07/2025
32199,"Land and Building in Ramanathapuram, Coimbatore","Coimbatore, Tamil Nadu",Bank of India,"₹56,56,000",08/07/2025
32927,"Villa in Kanathur Reddykuppam, Kanchipuram","Kanchipuram, Tamil Nadu",Bank of India,"₹4,30,00,000",08/07/2025
63616,"Industrial Land and Building in Sandhpore, Valsad","Valsad, Gujarat",Bank Of Baroda,"₹26,50,000",08/07/2025
63698,Site in Yeshwanthpura Hobli,"Yeshwanthpura Hobli, Bangalore Urba, Karnataka",City Union Bank,"₹42,00,000",08/07/2025
63699,Site in Yeshwanthpura Hobli,"Yeshwanthpura Hobli, Bangalore Urba, Karnataka",City Union Bank,"₹84,00,000",08/07/2025
63700,Land and Building in Narasimharaja,"Narasimharaja, Bangalore Urba, Karnataka",City Union Bank,"₹44,00,000",08/07/2025
63701,House in KR Puram Hobli,"KR Puram Hobli, Bangalore Urba, Karnataka",City Union Bank,"₹22,00,000",08/07/2025
63925,Flat in Anekal,"Anekal, Karnataka",Canara Bank,"₹33,39,000",08/07/2025
64617,Site in Yeshwanthpura Hobli,"Yeshwanthpura Hobli, Bangalore Urba, Karnataka",Truhome Finance Limited,"₹56,00,000",08/07/2025
64618,Flat in Anekal,"Anekal, Karnataka",Bank of India,"₹46,55,000",08/07/2025
64619,Flat in Anekal,"Anekal, Karnataka",Bank of India,"₹46,55,000",08/07/2025
64620,Plot in Bengaluru,"Bangalore Urba, Karnataka",Bank of India,"₹1,00,00,000",08/07/2025
64624,House in Bidar,"Bidar, Karnataka",Canara Bank,"₹86,08,000",08/07/2025
64655,Site in Varthur,"Varthur, Bangalore Urba, Karnataka",ICICI Bank,"₹25,00,000",08/07/2025
64657,Flat in Anekal,"Anekal, Karnataka",Canara Bank,"₹33,39,000",08/07/2025
64659,Flat in Anekal,"Anekal, Karnataka",Canara Bank,"₹33,55,000",08/07/2025
64771,"Land and Building in Koth village, Ahmedabad","Ahmedabad, Gujarat",State Bank of India,"₹16,20,00,000",08/07/2025
63326,Plot in Darjeeling,"Darjeeling, West Bengal",ICICI Bank,"₹25,50,000",08/07/2025
63329,Plot in Darjeeling,"Darjeeling, West Bengal",ICICI Bank,"₹30,00,000",08/07/2025
63330,Plot in Darjeeling,"Darjeeling, West Bengal",ICICI Bank,"₹26,00,000",08/07/2025
63331,Plot in Darjeeling,"Darjeeling, West Bengal",ICICI Bank,"₹30,00,000",08/07/2025
64872,Plot in Mehsana,"Mehsana, Gujarat",Piramal Capital and Housing Finance,"₹16,40,000",08/07/2025
64919,"Land and Building in Moradabad, Lucknow","Lucknow, Uttar Pradesh",Indian Bank,"₹14,19,000",08/07/2025
64920,"Residential Flat in Muzaffarnagar, Lucknow","Lucknow, Uttar Pradesh",Indian Bank,"₹12,01,000",08/07/2025
64921,"Commercial Property in Bijnor, Lucknow","Lucknow, Uttar Pradesh",Indian Bank,"₹42,30,000",08/07/2025
64924,"House in Meerut, Lucknow","Lucknow, Uttar Pradesh",Indian Bank,"₹25,00,000",08/07/2025
64925,"Land and Building in Gorakhpur, Lucknow","Lucknow, Uttar Pradesh",State Bank of India,"₹8,28,00,000",08/07/2025
64926,"House in Aligarh, Lucknow","Lucknow, Uttar Pradesh",Bank of India,"₹24,30,000",08/07/2025
64928,"Plot in Pilibhit, Lucknow","Lucknow, Uttar Pradesh",Bank of India,"₹86,92,000",08/07/2025
64929,"Plant and Machinery in Pilibhit, Lucknow","Lucknow, Uttar Pradesh",Bank of India,"₹12,45,000",08/07/2025
64931,"Flat in Mohanlalganj, Lucknow","Lucknow, Uttar Pradesh",Piramal Capital and Housing Finance,"₹22,70,000",08/07/2025
64932,"Plot in Mirzapur, Lucknow","Lucknow, Uttar Pradesh",Piramal Capital and Housing Finance,"₹25,70,000",08/07/2025
64933,"Plot in Shahjahanpur, Lucknow","Lucknow, Uttar Pradesh",Piramal Capital and Housing Finance,"₹3,20,000",08/07/2025
64935,"Plot in Kanpur, Lucknow","Lucknow, Uttar Pradesh",Piramal Capital and Housing Finance,"₹14,60,000",08/07/2025
64936,"Plot in Chandauli, Lucknow","Lucknow, Uttar Pradesh",Piramal Capital and Housing Finance,"₹6,20,000",08/07/2025
64938,"Plot in Hardoi, Lucknow","Lucknow, Uttar Pradesh",Piramal Capital and Housing Finance,"₹8,70,000",08/07/2025
64940,"Flat in Sahara Estate, Lucknow","Lucknow, Uttar Pradesh",Piramal Capital and Housing Finance,"₹34,00,000",08/07/2025
64941,"Flat in Janki Vihar Colony, Lucknow","Lucknow, Uttar Pradesh",Piramal Capital and Housing Finance,"₹30,60,000",08/07/2025
64942,"Flat in Janakipuram, Lucknow","Lucknow, Uttar Pradesh",Piramal Capital and Housing Finance,"₹30,60,000",08/07/2025
64943,"Flat in Janakipuram, Lucknow","Lucknow, Uttar Pradesh",Piramal Capital and Housing Finance,"₹32,90,000",08/07/2025
64944,"Flat in Janakipuram, Lucknow","Lucknow, Uttar Pradesh",Piramal Capital and Housing Finance,"₹34,00,000",08/07/2025
64945,"Plot in Bareilly, Lucknow","Lucknow, Uttar Pradesh",Piramal Capital and Housing Finance,"₹8,80,000",08/07/2025
64946,"Plot in Bareilly, Lucknow","Lucknow, Uttar Pradesh",Piramal Capital and Housing Finance,"₹8,80,000",08/07/2025
64947,"Plot in Shahjahanpur, Lucknow","Lucknow, Uttar Pradesh",Piramal Capital and Housing Finance,"₹12,30,000",08/07/2025
64948,"Plot in Mohanlalganj, Lucknow","Lucknow, Uttar Pradesh",Piramal Capital and Housing Finance,"₹13,70,000",08/07/2025
64949,"Flat in Mohanlalganj, Lucknow","Lucknow, Uttar Pradesh",Piramal Capital and Housing Finance,"₹18,60,000",08/07/2025
64950,"House in Paragana, Lucknow","Lucknow, Uttar Pradesh",Piramal Capital and Housing Finance,"₹28,60,000",08/07/2025
64951,"Flat in Gram Mau, Lucknow","Lucknow, Uttar Pradesh",Piramal Capital and Housing Finance,"₹18,60,000",08/07/2025
64017,Plot for Sale,"Kotputli, Jaipur, Rajasthan",Edelweiss Housing Finance,"₹31,00,000",08/07/2025
64018,Land for Sale,"Ramganjmandi, Kota, Rajasthan",Au small finance bank,"₹34,70,000",08/07/2025
64019,Commercial Property for Sale,"Ramganjmandi, Kota, Rajasthan",Au small finance bank,"₹28,20,000",08/07/2025
64020,Plot for Sale,"Bhopalsagar, Chittorgarh, Rajasthan",Au small finance bank,"₹6,10,000",08/07/2025
64021,Plot for Sale,"Nimbahera, Chittorgarh, Rajasthan",Au small finance bank,"₹14,40,000",08/07/2025
64024,Plot for Sale,"PIND, Chittorgarh, Rajasthan",Au small finance bank,"₹8,55,000",08/07/2025
64026,Plot for Sale,"Amet, Rajsamand, Rajasthan",Au small finance bank,"₹20,00,000",08/07/2025
64027,Land for Sale,"Bhopalgarh, Jodhpur, Rajasthan",Au small finance bank,"₹33,30,000",08/07/2025
64029,Land for Sale,"Nainwan, Bundi, Rajasthan",Au small finance bank,"₹6,25,000",08/07/2025
64032,Land for Sale,"Sumerpur, Pali, Rajasthan",Au small finance bank,"₹11,00,000",08/07/2025
64036,Land for Sale,"Krish Upaj Mandi, Dausa, Rajasthan",Au small finance bank,"₹30,01,000",08/07/2025
64040,Land for Sale,"BIRASANA, Jaipur, Rajasthan",Au small finance bank,"₹13,40,000",08/07/2025
64042,Land for Sale,"Kotputli, Jaipur, Rajasthan",Au small finance bank,"₹13,80,000",08/07/2025
64045,Land for Sale,"PHAGI, Jaipur, Rajasthan",Au small finance bank,"₹3,50,000",08/07/2025
64047,Land for Sale,"Kotputli, Jaipur, Rajasthan",Au small finance bank,"₹20,40,000",08/07/2025
64050,Land for Sale,"Senti, Chittorgarh, Rajasthan",Au small finance bank,"₹23,50,000",08/07/2025
64053,Land for Sale,"Saropa Kapasan, Chittorgarh, Rajasthan",Au small finance bank,"₹7,20,000",08/07/2025
64057,Land for Sale,"SAMITI PHAGI, Jaipur, Rajasthan",Au small finance bank,"₹8,60,000",08/07/2025
64059,Land for Sale,"Bawadi, Bundi, Rajasthan",Au small finance bank,"₹27,20,000",08/07/2025
64062,Residential Plot for Sale,"Anupgarh, Ganganagar, Rajasthan",Au small finance bank,"₹68,00,000",08/07/2025
64258,"Plot in pargana Loni, Ghaziabad","Ghaziabad, Uttar Pradesh",City Union Bank,"₹16,00,000",08/07/2025
64260,"Commercial Property in Ramanuj, Ghaziabad","Ghaziabad, Uttar Pradesh",Bank of India,"₹23,78,000",08/07/2025
64262,"Flat in Vasundhara, Ghaziabad","Ghaziabad, Uttar Pradesh",Truhome Finance Limited,"₹23,00,000",08/07/2025
64263,"Flat in pargana Loni, Ghaziabad","Ghaziabad, Uttar Pradesh",HDFC Bank,"₹26,90,000",08/07/2025
64266,"Residential Flat in pargana Loni, Ghaziabad","Ghaziabad, Uttar Pradesh",HDFC Bank,"₹10,40,000",08/07/2025
64269,"Residential Flat in Vaishali, Ghaziabad","Ghaziabad, Uttar Pradesh",Bank of India,"₹60,80,000",08/07/2025
64384,"Flat in Ayyanchery, Kancheepuram","Kanchipuram, Tamil Nadu",Bank of India,"₹45,00,000",08/07/2025
64401,"House in Sherpur, Bareilly","Bareilly, Uttar Pradesh",Indian Bank,"₹42,07,000",08/07/2025
64462,Land and Building in parganas,"parganas, Kolkata, West Bengal",State Bank of India,"₹8,28,00,000",08/07/2025
63112,Flat in 24 Parganas South,"South 24 Parganas, West Bengal",City Union Bank,"₹23,00,000",08/07/2025
63126,"Land in Marchinaickenpalayam, Coimbatore","Coimbatore, Tamil Nadu",Canara Bank,"₹30,34,000",08/07/2025
60845,"Land and Building in Batlagundu, Dindigul","Dindigul, Tamil Nadu",State Bank of India,"₹24,50,000",08/07/2025
60848,"Land and Building in Kombaipatti, Dindigul","Dindigul, Tamil Nadu",State Bank of India,"₹11,60,000",08/07/2025
60963,"Land in Killiyoor, Kanyakumari","Kanyakumari, Tamil Nadu",Canara Bank,"₹78,20,000",08/07/2025
61102,Land and Building for Sale,"Malappuram, Malappuram, Kerala",axis finance,"₹2,68,09,000",08/07/2025
61187,House in Kodialbail,"Kodialbail, Mangalore, Karnataka",ICICI Bank,"₹2,44,00,000",08/07/2025
61208,Land and Building in Maroli,"Maroli, Mangalore, Karnataka",State Bank of India,"₹1,85,00,000",08/07/2025
58761,Plot for Sale,"Bogaram, Medchal-Malkajgiri, Telangana",State Bank of India,"₹40,20,000",08/07/2025
58766,Plot for Sale,"Malkajgiri, Medchal-Malkajgiri, Telangana",State Bank of India,"₹24,52,000",08/07/2025
58775,Plot for Sale,"Malkajgiri, Medchal-Malkajgiri, Telangana",State Bank of India,"₹25,59,400",08/07/2025
58779,Plot for Sale,"Malkajgiri, Medchal-Malkajgiri, Telangana",State Bank of India,"₹44,62,200",08/07/2025
58783,Plot for Sale,"Bogaram, Medchal-Malkajgiri, Telangana",State Bank of India,"₹30,14,000",08/07/2025
58786,Plot for Sale,"Bogaram, Medchal-Malkajgiri, Telangana",State Bank of India,"₹31,92,100",08/07/2025
58791,Plot for Sale,"Bogaram, Medchal-Malkajgiri, Telangana",State Bank of India,"₹44,38,800",08/07/2025
58793,Plot for Sale,"Bogaram, Medchal-Malkajgiri, Telangana",State Bank of India,"₹10,13,800",08/07/2025
58796,Plot for Sale,"Bogaram, Medchal-Malkajgiri, Telangana",State Bank of India,"₹38,22,300",08/07/2025
58799,Plot for Sale,"Bogaram, Medchal-Malkajgiri, Telangana",State Bank of India,"₹36,57,900",08/07/2025
58801,Plot for Sale,"Bogaram, Medchal-Malkajgiri, Telangana",State Bank of India,"₹30,14,000",08/07/2025
58804,Plot for Sale,"Bogaram, Medchal-Malkajgiri, Telangana",State Bank of India,"₹14,52,200",08/07/2025
58807,Plot for Sale,"Bogaram, Medchal-Malkajgiri, Telangana",State Bank of India,"₹6,12,000",08/07/2025
58834,House in Junagadh,"Junagadh, Gujarat",Au small finance bank,"₹10,00,000",08/07/2025
58842,Plot for Sale,"Bogaram, Medchal-Malkajgiri, Telangana",State Bank of India,"₹21,44,000",08/07/2025
58843,Plot for Sale,"Bogaram, Medchal-Malkajgiri, Telangana",State Bank of India,"₹19,02,800",08/07/2025
58845,Plot for Sale,"Bogaram, Medchal-Malkajgiri, Telangana",State Bank of India,"₹18,09,000",08/07/2025
58846,Plot for Sale,"Bogaram, Medchal-Malkajgiri, Telangana",State Bank of India,"₹17,82,200",08/07/2025
58849,Plot for Sale,"Bogaram, Medchal-Malkajgiri, Telangana",State Bank of India,"₹30,28,400",08/07/2025
58853,Plot for Sale,"Bogaram, Medchal-Malkajgiri, Telangana",State Bank of India,"₹27,54,000",08/07/2025
58856,Plot for Sale,"Bogaram, Medchal-Malkajgiri, Telangana",State Bank of India,"₹27,00,000",08/07/2025
58857,Plot for Sale,"Bogaram, Medchal-Malkajgiri, Telangana",State Bank of India,"₹32,40,000",08/07/2025
58859,Plot for Sale,"Bogaram, Medchal-Malkajgiri, Telangana",State Bank of India,"₹31,59,000",08/07/2025
58862,Plot for Sale,"Bogaram, Medchal-Malkajgiri, Telangana",State Bank of India,"₹16,59,200",08/07/2025
59027,"Flat in Timbawadi, Junagadh","Junagadh, Gujarat",Au small finance bank,"₹4,20,000",08/07/2025
59081,"Land in Kadval, Dahod","Dahod, Gujarat",Au small finance bank,"₹11,00,000",08/07/2025
59083,"Land in Khedbrahma, Sabarkantha","Sabarkantha, Gujarat",Au small finance bank,"₹5,20,000",08/07/2025
59191,Land in Kapurthala,"Kapurthala, Punjab",Au small finance bank,"₹15,65,000",08/07/2025
59192,Land in Firozpur,"Firozpur, Punjab",Au small finance bank,"₹8,10,000",08/07/2025
59389,"Land and Building in Pappampatty, Coimbatore","Coimbatore, Tamil Nadu",South Indian Bank,"₹3,26,00,000",08/07/2025
59410,Land and Building in Berhampore,"Berhampore, Kolkata, West Bengal",Indian Bank,"₹39,69,900",08/07/2025
60034,"Plot in Kadval, Dahod","Dahod, Gujarat",Au small finance bank,"₹11,00,000",08/07/2025
60443,Plot in Ramanagara,"Ramanagara, Karnataka",Canfin,"₹9,00,000",08/07/2025
60467,"Land in Thally Village, Krishnagiri","Krishnagiri, Tamil Nadu",Cholamandalam Investment and Finance Company,"₹4,57,800",08/07/2025
60491,Commercial Property in Bangarapet,"Bangarapet, Bangalore Urba, Karnataka",Axis Bank,"₹1,53,66,650",08/07/2025
60678,"Bungalow in Himatnagar,Sabarkantha","Sabarkantha, Gujarat",Federal Bank,"₹63,00,000",08/07/2025
61934,"Land and Building in Konjikuppam Village, Cuddalore","Cuddalore, Tamil Nadu",City Union Bank,"₹22,00,000",08/07/2025
62142,"Land and Building in Deesa, Banaskantha","Banaskantha, Gujarat",Cholamandalam Investment and Finance Company,"₹40,86,500",08/07/2025
61619,Land and Building for Sale,"Chilakaluripet, Palnadu, Andhra Pradesh",Bank of India,"₹25,92,000",08/07/2025
61773,"Site in Marungur Village, Cuddalore","Cuddalore, Tamil Nadu",Canara Bank,"₹45,00,000",08/07/2025
61869,Plot for Sale,"Keesara Mandal, Medchal-Malkajgiri, Telangana",State Bank of India,"₹30,14,000",08/07/2025
61880,Plot in Goindwal Sahib,"Goindwal Sahib, Ludhiana, Punjab",Bank Of Baroda,"₹76,33,000",07/07/2025
59619,Plot in Ludhiana,"Ludhiana, Punjab",Cholamandalam Investment and Finance Company,"₹1,66,26,000",07/07/2025
59745,"Land and building in Abishekapuram, Trichy","Tiruchirappalli, Tamil Nadu",Punjab National Bank,"₹35,00,000",07/07/2025
59822,"Residential Building in Naroda, Ahmedabad","Ahmedabad, Gujarat",Axis Bank,"₹1,45,00,000",07/07/2025
59967,Others in Bengaluru,"Bangalore Urba, Karnataka",Bank Of Baroda,"₹1,18,000",07/07/2025
60031,"House in Veraval, Gir Somnath","Gir Somnath, Gujarat",Nido Home Finance,"₹28,71,600",07/07/2025
60190,"Site in Kannampalayam, Coimbatore","Coimbatore, Tamil Nadu",PNB Housing Finance,"₹23,09,000",07/07/2025
60962,"House in Melachokkanathapuram, Theni","Theni, Tamil Nadu",HomeFirst Finance,"₹19,88,368",07/07/2025
61190,Land and Building in Udupi,"Udupi, Karnataka",Canara Bank,"₹33,23,000",07/07/2025
61191,Land in Udupi,"Udupi, Karnataka",Canara Bank,"₹14,47,000",07/07/2025
61209,House in Dakshina Kannada,"Dakshina Kannada, Karnataka",State Bank of India,"₹56,32,564",07/07/2025
61254,Commercial Property in Kadri,"Kadri, Mangalore, Karnataka",Bank Of Baroda,"₹32,64,000",07/07/2025
61255,Commercial Property in Sullia,"Sullia, Mangalore, Karnataka",Bank Of Baroda,"₹2,71,00,000",07/07/2025
61286,"Flat in Mehamadabad, Kheda","Kheda, Gujarat",Bank Of Baroda,"₹18,28,710",07/07/2025
61286,"Flat in Mehamadabad, Kheda","Kheda, Gujarat",Bank Of Baroda,"₹18,28,710",07/07/2025
61294,"Land and Building in Nadiad, Kheda","Kheda, Gujarat",Bank Of Baroda,"₹14,51,000",07/07/2025
61308,"Land in Lambhvel, Anand","Anand, Gujarat",Bank Of Baroda,"₹10,23,300",07/07/2025
58865,"House in Udhagamandalam, Nigiris","Nilgiris, Tamil Nadu",ICICI Bank,"₹1,69,00,000",07/07/2025
58870,"House in Kuthalam Village, Nagapattinam","Nagapattinam, Tamil Nadu",ICICI Bank,"₹40,00,000",07/07/2025
58876,"Land and Building in Udhagamandalam, Nilgiris","Nilgiris, Tamil Nadu",ICICI Bank,"₹1,69,00,000",07/07/2025
58879,"Land and Building in Sambavar Vadakarai, Tenkasi","Tenkasi, Tamil Nadu",Repco Home Finance,"₹30,10,000",07/07/2025
58904,"Industrial Land in Chettipedu, Kanchipuram","Kanchipuram, Tamil Nadu",Karur Vysya Bank,"₹21,50,00,000",07/07/2025
58906,"Plot in Kavalkazhani, Kanchipuram","Kanchipuram, Tamil Nadu",City Union Bank,"₹19,00,000",07/07/2025
59200,House in Haibowal Kalan,"Haibowal Kalan, Ludhiana, Punjab",Truhome Finance Limited,"₹37,30,000",07/07/2025
62080,Commercial Property in Anand,"Anand, Gujarat",Bank Of Baroda,"₹9,99,999",07/07/2025
62112,"Land in Jhabadiya, Banskatha","Banaskantha, Gujarat",Nivas Housing Finance,"₹14,50,000",07/07/2025
62127,"Plot in Dhori, Banaskantha","Banaskantha, Gujarat",Nivas Housing Finance,"₹5,50,000",07/07/2025
62134,"Plot in Karza(Jethi), Banaskantha","Banaskantha, Gujarat",Nivas Housing Finance,"₹6,25,000",07/07/2025
62146,"Flat in Ruva, Bhavnagar","Bhavnagar, Gujarat",HDFC Bank,"₹13,10,000",07/07/2025
62147,"Commercial Property in Narol, Ahmedabad","Ahmedabad, Gujarat",HDFC Bank,"₹49,50,000",07/07/2025
62234,"Land and Building in Reddiyapatti Village, Dindigul","Dindigul, Tamil Nadu",City Union Bank,"₹4,00,000",07/07/2025
62238,"Land and Building in Kottampatti, Madurai","Madurai, Tamil Nadu",City Union Bank,"₹15,00,000",07/07/2025
62312,"House Site in Sivakasi Village, Virudhunagar","Virudhunagar, Tamil Nadu",Karur Vysya Bank,"₹68,00,000",07/07/2025
62370,Land and Building in Ballari,"Ballari, Bangalore Urba, Karnataka",Canara Bank,"₹1,10,00,000",07/07/2025
62418,"Commercial Property in Makarba, Ahmedabad","Ahmedabad, Gujarat",Bank Of Baroda,"₹1,08,62,000",07/07/2025
62583,"Flat in Naroda, Ahmedabad","Ahmedabad, Gujarat",Bank Of Baroda,"₹20,17,800",07/07/2025
62597,"Flat in Ranip, Ahmedabad","Ahmedabad, Gujarat",Bank Of Baroda,"₹37,80,000",07/07/2025
62621,"House in Wadhwan, Surendranagar","Surendranagar, Gujarat",HomeFirst Finance,"₹12,72,046",07/07/2025
62632,"Plot in Satlasana, Mehsana","Mehsana, Gujarat",Bank Of Baroda,"₹27,22,000",07/07/2025
62637,"Flat in Hathijan, Ahmedabad","Ahmedabad, Gujarat",Bank Of Baroda,"₹18,09,000",07/07/2025
60276,Land and Building in Haveri,"Haveri, Karnataka",Canara Bank,"₹1,51,00,000",07/07/2025
60373,House in Puttenahalli,"Puttenahalli, Bangalore Urba, Karnataka",Indian Overseas Bank,"₹71,97,000",07/07/2025
60377,Plot in udupi,"Udupi, Karnataka",ICICI Home Finance Company,"₹25,96,176",07/07/2025
60382,Residential Flat in Uttarahalli Hobli,"Uttarahalli Hobli, Bangalore Urba, Karnataka",Bank of Maharashtra,"₹29,42,000",07/07/2025
60384,Commercial Property in Jigani Hobli,"Jigani Hobli, Bangalore Urba, Karnataka",Bank of Maharashtra,"₹1,08,00,000",07/07/2025
60388,Commercial Property in Jigani Hobli,"Jigani Hobli, Bangalore Urba, Karnataka",Bank of Maharashtra,"₹1,17,60,000",07/07/2025
60389,Residential Flat in Rajaji Nagar,"Rajaji Nagar, Bangalore Urba, Karnataka",Bank of Maharashtra,"₹1,01,00,000",07/07/2025
60391,Residential Plot in Yeshwanthpura Hobli,"Yeshwanthpura Hobli, Bangalore Urba, Karnataka",Bank of Maharashtra,"₹1,31,20,000",07/07/2025
60393,Residential Flat in Varthur,"Varthur, Bangalore Urba, Karnataka",Bank of Maharashtra,"₹50,35,000",07/07/2025
60420,"Plot in Elayanellore, Vellore","Vellore, Tamil Nadu",Canara Bank,"₹42,88,000",07/07/2025
60424,"Land in Perumalkuppam, Vellore","Vellore, Tamil Nadu",Canara Bank,"₹68,92,000",07/07/2025
60439,Residential Plot in Uttarahalli,"Uttarahalli, Bangalore Urba, Karnataka",Bank of Maharashtra,"₹86,76,000",07/07/2025
60445,House in Yeshwanthpura Hobli,"Yeshwanthpura Hobli, Bangalore Urba, Karnataka",State Bank of India,"₹3,33,60,000",07/07/2025
60451,"Flat in Anakaputhur, Kanchipuram","Kanchipuram, Tamil Nadu",HDFC Bank,"₹41,00,000",07/07/2025
60452,"Flat in Thirumullaivoyal, Thiruvallure","Tiruvallur, Tamil Nadu",HDFC Bank,"₹40,00,000",07/07/2025
60454,"Flat in Kovilpathagai, Thiruvallur","Tiruvallur, Tamil Nadu",HDFC Bank,"₹27,00,000",07/07/2025
60456,"Flat in Chrompet, Chennai","Chennai, Tamil Nadu",HDFC Bank,"₹35,00,000",07/07/2025
60457,"Flat in Kayarambedu, Kancheepuram","Kanchipuram, Tamil Nadu",HDFC Bank,"₹29,00,000",07/07/2025
60458,"Flat in Nanthivaram, Kancheepuram","Kanchipuram, Tamil Nadu",HDFC Bank,"₹15,00,000",07/07/2025
60516,"Land and Building in Periyapalayam, Thiruvallur","Tiruvallur, Tamil Nadu",Equitas Small Finance Bank,"₹25,45,500",07/07/2025
60589,"Plot in Ankleshwar, Bharuch","Bharuch, Gujarat",ICICI Bank,"₹20,80,000",07/07/2025
60676,"Commercial Property in Borsad Chowkdi, Anand","Anand, Gujarat",Bank Of Baroda,"₹4,61,700",07/07/2025
60682,"Plot in Narol, Ahmedabad","Ahmedabad, Gujarat",PNB Housing Finance,"₹13,03,000",07/07/2025
60685,"Flat in Kalol, Gandhinagar","Valsad, Gujarat",PNB Housing Finance,"₹10,47,000",07/07/2025
60685,"Flat in Kalol, Gandhinagar","Valsad, Gujarat",PNB Housing Finance,"₹10,47,000",07/07/2025
